{
  "version": 1,
  "kind": "hanlint.evidenceEntailmentBenchmark",
  "benchmarkId": "klue-nli-v1.1-dev-balanced-36",
  "source": {
    "name": "KLUE-NLI v1.1 dev",
    "repositoryUrl": "https://github.com/KLUE-benchmark/KLUE",
    "paperUrl": "https://arxiv.org/html/2105.09680v4",
    "sourceUrl": "https://raw.githubusercontent.com/KLUE-benchmark/KLUE/3efd98708a40ff49251fddde35453f8fbb11f536/klue_benchmark/klue-nli-v1.1/klue-nli-v1.1_dev.json",
    "revision": "3efd98708a40ff49251fddde35453f8fbb11f536",
    "sourceSha256": "0699db82be17766b26e199864e6260443e17ec6e91d1870e876419e388f245b1",
    "license": "CC-BY-SA-4.0",
    "attribution": "KLUE Benchmark contributors"
  },
  "selection": {
    "method": "source와 원본 label별 GUID SHA256 오름차순에서 합의·중복 조건을 만족한 앞의 두 사례",
    "sources": [
      "NSMC",
      "airbnb",
      "policy",
      "wikinews",
      "wikipedia",
      "wikitree"
    ],
    "sourceLabels": [
      "contradiction",
      "entailment",
      "neutral"
    ],
    "labelMap": {
      "contradiction": "contradicted",
      "entailment": "supported",
      "neutral": "insufficient"
    },
    "casesPerSourceLabel": 2,
    "minimumAgreement": 4,
    "premiseDuplicates": 0,
    "hypothesisDuplicates": 0
  },
  "cases": [
    {
      "id": "KEN001",
      "sourceGuid": "klue-nli-v1_dev_01351",
      "domain": "NSMC",
      "evidenceExcerpt": "세익스피어가 이렇게 차별주의적인 사람이었다",
      "atomicFact": "세익스피어는 평등한 대우를 하는 사람이었다.",
      "goldLabel": "contradicted",
      "annotation": {
        "authorLabel": "contradicted",
        "validatorLabels": [
          "contradicted",
          "contradicted",
          "contradicted",
          "contradicted"
        ],
        "agreeingVotes": 5,
        "totalVotes": 5
      },
      "sourceUrl": "https://raw.githubusercontent.com/KLUE-benchmark/KLUE/3efd98708a40ff49251fddde35453f8fbb11f536/klue_benchmark/klue-nli-v1.1/klue-nli-v1.1_dev.json",
      "revision": "3efd98708a40ff49251fddde35453f8fbb11f536",
      "locator": "klue-nli-v1_dev_01351",
      "excerptSha256": "607e45886ffa542ec6809961e64e500ab1484b9f24e0e685b534bac526039526",
      "factSha256": "43947d9e5e05105a1a8d4c4793f637f26baf772a60144d5d0f6ae692d220e849",
      "license": "CC-BY-SA-4.0",
      "caseSha256": "d23ca1b81e5e58b7f6a36d95ff159745477e6ea4d62f379f9e149cf3dd01870f"
    },
    {
      "id": "KEN002",
      "sourceGuid": "klue-nli-v1_dev_01564",
      "domain": "NSMC",
      "evidenceExcerpt": "어릴때 이거보고 심오한기분과 저 고양이가 무서웠다",
      "atomicFact": "어릴 때는 이걸 보고 기분이 좋았다.",
      "goldLabel": "contradicted",
      "annotation": {
        "authorLabel": "contradicted",
        "validatorLabels": [
          "contradicted",
          "contradicted",
          "insufficient",
          "contradicted"
        ],
        "agreeingVotes": 4,
        "totalVotes": 5
      },
      "sourceUrl": "https://raw.githubusercontent.com/KLUE-benchmark/KLUE/3efd98708a40ff49251fddde35453f8fbb11f536/klue_benchmark/klue-nli-v1.1/klue-nli-v1.1_dev.json",
      "revision": "3efd98708a40ff49251fddde35453f8fbb11f536",
      "locator": "klue-nli-v1_dev_01564",
      "excerptSha256": "81a52362109456988f8f09692b5ef14203c2e5313141c338972683cd7a7d80e2",
      "factSha256": "0488d13da4b4e2da915ddd08aa082546cd7ca28d3765063d29df17845cec85a8",
      "license": "CC-BY-SA-4.0",
      "caseSha256": "e9c20a1fb605f3aa194d55ff5a1524dcbba5f78d1e1982049569fdbee78fd4cb"
    },
    {
      "id": "KEN003",
      "sourceGuid": "klue-nli-v1_dev_01707",
      "domain": "NSMC",
      "evidenceExcerpt": "영화학과 대학생이 만든 졸업작품을 본 듯한 느낌이었습니다",
      "atomicFact": "마치 영화학과 대학생의 졸업작품 같았습니다.",
      "goldLabel": "supported",
      "annotation": {
        "authorLabel": "supported",
        "validatorLabels": [
          "supported",
          "insufficient",
          "supported",
          "supported"
        ],
        "agreeingVotes": 4,
        "totalVotes": 5
      },
      "sourceUrl": "https://raw.githubusercontent.com/KLUE-benchmark/KLUE/3efd98708a40ff49251fddde35453f8fbb11f536/klue_benchmark/klue-nli-v1.1/klue-nli-v1.1_dev.json",
      "revision": "3efd98708a40ff49251fddde35453f8fbb11f536",
      "locator": "klue-nli-v1_dev_01707",
      "excerptSha256": "6dadab2f3b8771265f23e9fbc48df9ce715db6345cde8e06149de8ef82349fbf",
      "factSha256": "6653ca2cecab2c1ee2897e0bbd448b7194a3082690610183cf6f0ff233c65e49",
      "license": "CC-BY-SA-4.0",
      "caseSha256": "4c20e3fd22b059ea2b054760de910319d2304d898446ee306eeeb6cdc11abe39"
    },
    {
      "id": "KEN004",
      "sourceGuid": "klue-nli-v1_dev_00957",
      "domain": "NSMC",
      "evidenceExcerpt": "마틴 릭스는 더티해리만큼이나멋지다 혹은 그이상",
      "atomicFact": "더티해리만큼 마틴릭스는 멋있었다.",
      "goldLabel": "supported",
      "annotation": {
        "authorLabel": "supported",
        "validatorLabels": [
          "supported",
          "supported",
          "supported",
          "supported"
        ],
        "agreeingVotes": 5,
        "totalVotes": 5
      },
      "sourceUrl": "https://raw.githubusercontent.com/KLUE-benchmark/KLUE/3efd98708a40ff49251fddde35453f8fbb11f536/klue_benchmark/klue-nli-v1.1/klue-nli-v1.1_dev.json",
      "revision": "3efd98708a40ff49251fddde35453f8fbb11f536",
      "locator": "klue-nli-v1_dev_00957",
      "excerptSha256": "5d4b2ee99178094bb785d535c79976cb8e81fa985af2635607692f97291b27bd",
      "factSha256": "227e0f9f5d6a4c4b07b7536548c466ca1ec3168232b85293869d33db536c0565",
      "license": "CC-BY-SA-4.0",
      "caseSha256": "80a16dfcf66d5dd50337d706471d7105c168c0bea896bb6af38dade6dc277243"
    },
    {
      "id": "KEN005",
      "sourceGuid": "klue-nli-v1_dev_01943",
      "domain": "NSMC",
      "evidenceExcerpt": "이 작품은 충분히 10점을 받을수 있다.",
      "atomicFact": "가능하다면 10점 만점에 15점을 주고 싶은 작품이다.",
      "goldLabel": "insufficient",
      "annotation": {
        "authorLabel": "insufficient",
        "validatorLabels": [
          "insufficient",
          "insufficient",
          "insufficient",
          "insufficient"
        ],
        "agreeingVotes": 5,
        "totalVotes": 5
      },
      "sourceUrl": "https://raw.githubusercontent.com/KLUE-benchmark/KLUE/3efd98708a40ff49251fddde35453f8fbb11f536/klue_benchmark/klue-nli-v1.1/klue-nli-v1.1_dev.json",
      "revision": "3efd98708a40ff49251fddde35453f8fbb11f536",
      "locator": "klue-nli-v1_dev_01943",
      "excerptSha256": "4d6978c397a53cc89bc13ee7ae82c75febd61a6eafddb608f455449e4774ce31",
      "factSha256": "7b3b2e13d2b43ddd55059a56fc97abec07d7b83024229e4d42554a4695ef62c0",
      "license": "CC-BY-SA-4.0",
      "caseSha256": "54c3eb8e013b1791d97bcddc18733dcc5a0069e727b6b358463d4437245fa271"
    },
    {
      "id": "KEN006",
      "sourceGuid": "klue-nli-v1_dev_00260",
      "domain": "NSMC",
      "evidenceExcerpt": "결국 이 모든 일들이 여주의 상상이라는 걸로 끝나야 말이되지.",
      "atomicFact": "결국 엔딩은 모든 일들이 실제 일어난 일이라는 것이었다.",
      "goldLabel": "insufficient",
      "annotation": {
        "authorLabel": "insufficient",
        "validatorLabels": [
          "insufficient",
          "insufficient",
          "contradicted",
          "insufficient"
        ],
        "agreeingVotes": 4,
        "totalVotes": 5
      },
      "sourceUrl": "https://raw.githubusercontent.com/KLUE-benchmark/KLUE/3efd98708a40ff49251fddde35453f8fbb11f536/klue_benchmark/klue-nli-v1.1/klue-nli-v1.1_dev.json",
      "revision": "3efd98708a40ff49251fddde35453f8fbb11f536",
      "locator": "klue-nli-v1_dev_00260",
      "excerptSha256": "fddf6ce62b7f4e578d2f3b835a594ecba75021ef65a46c27d1791ded9998f0c6",
      "factSha256": "8887dc810f60946ccca355cc4fb56597e19b89308186239547863a1807c63d00",
      "license": "CC-BY-SA-4.0",
      "caseSha256": "e412026c667f8db312951e7d43026aeff31620ddd494824cabe10f8921eea0ff"
    },
    {
      "id": "KEN007",
      "sourceGuid": "klue-nli-v1_dev_00424",
      "domain": "airbnb",
      "evidenceExcerpt": "그 덕에 불편함이 없이 여행을 할수 있었다.",
      "atomicFact": "여행은 불편한 점 투성이었다.",
      "goldLabel": "contradicted",
      "annotation": {
        "authorLabel": "contradicted",
        "validatorLabels": [
          "contradicted",
          "contradicted",
          "contradicted",
          "contradicted"
        ],
        "agreeingVotes": 5,
        "totalVotes": 5
      },
      "sourceUrl": "https://raw.githubusercontent.com/KLUE-benchmark/KLUE/3efd98708a40ff49251fddde35453f8fbb11f536/klue_benchmark/klue-nli-v1.1/klue-nli-v1.1_dev.json",
      "revision": "3efd98708a40ff49251fddde35453f8fbb11f536",
      "locator": "klue-nli-v1_dev_00424",
      "excerptSha256": "d084050a1b7f7e69c93caaf2234fc34c8c092aa4a75e724287d79a85ac42825b",
      "factSha256": "71f30489ee709af8aa1652a4270effe084379c91068bf2817a875c590d68652e",
      "license": "CC-BY-SA-4.0",
      "caseSha256": "11ba6e90b6944f225db48ef358a7cf86feb14ba72e4edb96fdadd9c8114d23af"
    },
    {
      "id": "KEN008",
      "sourceGuid": "klue-nli-v1_dev_01381",
      "domain": "airbnb",
      "evidenceExcerpt": "수압쎈거랑 잘때 안추웠던게 넘 맘에들었어요",
      "atomicFact": "잘 때 너무 추웠어요.",
      "goldLabel": "contradicted",
      "annotation": {
        "authorLabel": "contradicted",
        "validatorLabels": [
          "contradicted",
          "contradicted",
          "supported",
          "contradicted"
        ],
        "agreeingVotes": 4,
        "totalVotes": 5
      },
      "sourceUrl": "https://raw.githubusercontent.com/KLUE-benchmark/KLUE/3efd98708a40ff49251fddde35453f8fbb11f536/klue_benchmark/klue-nli-v1.1/klue-nli-v1.1_dev.json",
      "revision": "3efd98708a40ff49251fddde35453f8fbb11f536",
      "locator": "klue-nli-v1_dev_01381",
      "excerptSha256": "4879c0d489246a70e2561f3ce926839bbff0f8efeb9eb8ae8140aabf94888e6e",
      "factSha256": "87b90d30f2ac6206a5db8a54dc5d12af063f409954720dee0dde1b076b169eb6",
      "license": "CC-BY-SA-4.0",
      "caseSha256": "a3a0090d83878d8e02cd9f65747b84d81ea48c869ab392e481ce82a729af2ac6"
    },
    {
      "id": "KEN009",
      "sourceGuid": "klue-nli-v1_dev_01022",
      "domain": "airbnb",
      "evidenceExcerpt": "뮌헨 우반은 베를린 보다 안전 한것 같습니다",